{
  "$schema": "http://json-schema.org/draft-07/schema#",
  "type": "object",
  "required": [
    "version",
    "locale",
    "task_type",
    "id",
    "source",
    "paragraph",
    "q_keywords_mcq",
    "q_center_sentence_mcq",
    "q_topic_free",
    "metainfo"
  ],
  "properties": {
    "version": {
      "type": "string"
    },
    "locale": {
      "type": "string"
    },
    "task_type": {
      "type": "string",
      "enum": [
        "paragraph"
      ]
    },
    "id": {
      "type": "string"
    },
    "source": {
      "type": "string"
    },
    "paragraph": {
      "type": "object",
      "required": [
        "text"
      ],
      "properties": {
        "topic_hint": {
          "type": "string"
        },
        "text": {
          "type": "string"
        }
      }
    },
    "q_keywords_mcq": {
      "type": "object",
      "required": [
        "stem",
        "choices",
        "answer_index",
        "rationale"
      ],
      "properties": {
        "stem": {
          "type": "string"
        },
        "choices": {
          "type": "array",
          "items": {
            "type": "string"
          },
          "minItems": 4,
          "maxItems": 4
        },
        "answer_index": {
          "type": "integer",
          "minimum": 0,
          "maximum": 3
        },
        "rationale": {
          "type": "string"
        }
      }
    },
    "q_center_sentence_mcq": {
      "type": "object",
      "required": [
        "stem",
        "sentences",
        "answer_idx",
        "rationale"
      ],
      "properties": {
        "stem": {
          "type": "string"
        },
        "sentences": {
          "type": "array",
          "items": {
            "type": "object",
            "properties": {
              "idx": {
                "type": "integer"
              },
              "text": {
                "type": "string"
              }
            }
          },
          "minItems": 5,
          "maxItems": 5
        },
        "answer_idx": {
          "type": "integer",
          "minimum": 1,
          "maximum": 5
        },
        "rationale": {
          "type": "string"
        }
      }
    },
    "q_topic_free": {
      "type": "object",
      "required": [
        "stem",
        "target_topic",
        "evaluation"
      ],
      "properties": {
        "stem": {
          "type": "string"
        },
        "target_topic": {
          "type": "string"
        },
        "evaluation": {
          "type": "object",
          "required": [
            "min_similarity"
          ],
          "properties": {
            "min_similarity": {
              "type": "number",
              "minimum": 0,
              "maximum": 1
            },
            "ignore_words": {
              "type": "array",
              "items": {
                "type": "string"
              }
            },
            "must_include_pos": {
              "type": "array",
              "items": {
                "type": "string"
              }
            }
          }
        },
        "feedback_guides": {
          "type": "array",
          "items": {
            "type": "string"
          }
        }
      }
    },
    "metainfo": {
      "type": "object"
    }
  }
}